Patent_Code,Patent_Number,Patent_ID,Status,Classes,Title,Organization
PV,2021-474,309302,Platný dokument,"B65D88/08, B65D88/74, B65D90/06, B65D90/22, B65D90/48",CS: Způsob skladování rostlinného oleje a zařízení k provádění způsobuEN: Method of storing vegetable oil and device for this,"Výzkumný ústav zemědělské techniky, v. v. i., Praha 6, Ruzyně, Česká republika"
PUV,2021-38703,35086,Platný dokument,"H01C7/12, H01T4/10, H02H9/06",CS: Svodič přepětí ve více pólovém provedení pro ochranu rozvodné sítěEN: Multi-pole surge arrester for grid protection,"SALTEK s.r.o., Ústí nad Labem, Krásné Březno, Česká republika"
PUV,2021-38817,35657,Platný dokument,"H04M11/02, H04N7/18, H04W84/12",CS: Domovní komunikační zařízeníEN: Home communication equipment,"Profconsult s.r.o., Praha 1, Nové Město, Česká republika"
PUV,2021-38904,35503,Platný dokument,A45C11/32,"CS: Pouzdro na klíče, hlava na klíče a schránka na klíčeEN: Key case, key head and key box","RNDr. Jaroslav Košut, Ph.D., MBA, Praha 5, Smíchov, Česká republika"
PUV,2021-39070,35408,Platný dokument,"F24F1/02, F24F12/00, F24F13/08, F24F13/28",CS: Vzduchotechnická jednotka s cirkulačním vytápěním a chlazenímEN: Air handling unit with circulating heating and cooling,"ATREA Group a.s., Jablonec nad Nisou, Rýnovice, Česká republika"
PUV,2021-39105,36583,Platný dokument,"B60L55/00, B60L53/60, B60L53/66",CS: Zařízení pro monitorování technického stavu akumulátorů množiny elektromobilůEN: Device for monitoring the technical condition of the batteries of electric cars,"Vysoká škola báňská – Technická univerzita Ostrava, Ostrava, Poruba, Česká republika"
PUV,2021-39194,35561,Platný dokument,"C02F11/18, C02F101/30",CS: Zařízení pro hydrotermochemickou úpravu bioodpadů na biouhel kombinovanou s odstranění škodlivinEN: Equipment for hydrothermochemical treatment of biowaste into biochar combined with removal of pollutants,"Výzkumný ústav rostlinné výroby, v. v. i., Praha 6, Ruzyně, Česká republika"
PUV,2021-39199,35506,Platný dokument,"C04B26/04, C04B14/06","CS: Stavební střešní, krytinový a dlažební materiál pro vodorovné, šikmé i svislé konstrukceEN: Building roofing, roofing and paving material for horizontal, inclined and vertical structures","Univerzita Tomáše Bati ve Zlíně, Zlín, Česká republika"
PUV,2021-39344,35618,Platný dokument,"C08L67/00, C08K3/013, C08K7/00, C08K3/01, C08K3/04, C08K3/26","CS: Porézní kompozice na bázi plně biodegradabilního polymeru, zejména pro zemědělské aplikaceEN: Porous compositions based on a fully biodegradable polymer, especially for agricultural applications","Univerzita Tomáše Bati ve Zlíně, Zlín, Česká republika"
PUV,2021-39360,35694,Platný dokument,"C08K5/49, C08K5/3492, C08L23/06, C08L23/16, G02B6/44",CS: Polymerní směs na výrobu samozhášivé mikrochráničky svazku optických kabelůEN: Polymer mixture for producing self-extinguishing microproters of optical cable bundles,"Univerzita Tomáše Bati ve Zlíně, Zlín, Česká republika"
PUV,2021-39365,35695,Platný dokument,"B01D29/01, C08F218/08, B82Y99/00, A01N65/00, B32B27/12, B32B27/18, B32B27/32, A62B9/06",CS: Filtrační materiálEN: Filter material,"Lubomír Olejar, Bzenec, Česká republika"
EP,2021-154596,3869257,Platný dokument na poshovovací lhůtě,"G02B21/36, G02B7/38, G02B21/24, G01N33/00, G02B21/16, G06T7/507, G06T7/00",EN: METHOD AND SYSTEM FOR IMAGING A CELL SAMPLE,"S.D. Sight Diagnostics Ltd., 6618356 Tel Aviv, Izrael"
EP,2021-158543,3892631,Neúčinný EP od počátku,"C07K14/725, C12N5/0783, A61K39/00, C07K16/28, A61P37/06",EN: FUSION PROTEIN FOR USE IN THE TREATMENT OF HVG DISEASE,"Medizinische Hochschule Hannover, 30625 Hannover, Spolková republika NěmeckoTechnische Universität Braunschweig, 38106 Braunschweig, Spolková republika Německo"
EP,2021-158544,3865506,Platný dokument,"C07K14/725, C12N5/0783, A61K39/00, A61P37/06, C07K16/28",EN: FUSION PROTEIN FOR USE IN THE TREATMENT OF HVG DISEASE,"Medizinische Hochschule Hannover, 30625 Hannover, Spolková republika NěmeckoTechnische Universität Braunschweig, 38106 Braunschweig, Spolková republika Německo"
EP,2021-161946,3878707,Neúčinný EP od počátku,"B61B12/06, G01H1/00",EN: METHOD OF CONTROLLING AN INSTALLATION FOR TRANSPORTING VEHICLES USING A CONTINUOUSLY MOVING CABLE AND A DEVICE CONFIGURED TO IMPLEMENT THE METHOD,"Bureau des Etudes de Câbles, 92260 Fontenay-aux-Roses, Francie"
EP,2021-164814,3859425,Platný dokument na poshovovací lhůtě,G02B21/36,EN: METHODS AND APPARATUS FOR DETECTING AN ENTITY IN A BODILY SAMPLE,"S.D. Sight Diagnostics Ltd., 6618356 Tel Aviv, Izrael"
EP,2021-189917,3923108,Platný dokument,"G05D16/20, E03B7/02, G06F17/11, E03B7/07",EN: MANAGEMENT OF LIQUID CONDUIT SYSTEMS,"IP2IPO Innovations Limited, London EC4N 8AF, Velká Británie"
EP,2021-194040,3955042,Platný dokument,"G02B7/38, G02B21/24, G02B21/36","EN: DIGITAL MICROSCOPY SYSTEMS, METHODS AND COMPUTER PROGRAM PRODUCTS","S.D. Sight Diagnostics Ltd., 6618356 Tel Aviv, Izrael"
EP,2021-386004,3865644,Neúčinný EP od počátku,"E05B65/08, E05C1/04, E05C9/02, E06B3/46, E05B79/20",EN: LOCKING MECHANISM FOR HIDDEN RECESSED FRAME,"PLASTICS OF SOUTHEAST EUROPE - ONE MAN LIMITED 
LIABILITY COMPANY - distinctive title SEU PLASTICS 
- ONE MAN L.L.C., 10-61100 Kilkis, Municipality of Kilkis, Řecko"
EP,2021-715909,4132905,Platný dokument,"C07C303/22, C09B11/10, C07C213/08, C07C303/06, C07C309/49",EN: PROCESS FOR SYNTHESIZING SULFONATED TRIARYL METHANE COMPOUNDS,"Provepharm Life Solutions, 13013 Marseille, Francie"
EP,2021-715910,4132906,Platný dokument,"C07C303/22, C07C309/49, C09B11/10, C07C213/08, C07C303/06",EN: PROCESS FOR SYNTHESIZING SULFONATED TRIARYL METHANE COMPOUNDS,"Provepharm Life Solutions, 13013 Marseille, Francie"
EP,2021-794212,4217271,Platný dokument,"B64C21/02, B64C21/08, B64D33/00, B64C3/26, B64C3/48, B64C9/16",EN: AN AIRCRAFT WING PROVIDED WITH A TRAILING EDGE REGION,"Technische Universiteit Delft, 2628 CN Delft, Nizozemsko"
EP,2021-802269,4238109,Platný dokument,G21K1/00,EN: ATOMIC COOLING AND TRAPPING METHODS AND APPARATUS,"University Of Southampton, Southampton, Hampshire SO17 1BJ, Velká Británie"
PV,2022-45,309746,Platný dokument,"G01L1/24, G01L1/00, B61L1/06, B61L1/00","CS: Kompozitní optovláknový senzor pro detekci tlakové síly vznikající průjezdem kola kolejového vozidla, jeho uspořádání a způsob detekce této tlakové síly pomocí tohoto uspořádáníEN: A composite fibre optic sensor for detecting the pressure force generated by the passage of a wheel of a rail vehicle, its arrangement and the method of detecting this pressure force using this arrangement","PRODIN a.s., Pardubice, Zelené Předměstí, Česká republikaVysoká škola báňská - Technická univerzita Ostrava, Ostrava, Poruba, Česká republika"
PV,2022-85,309574,Platný dokument,"B60B3/00, B60B3/16, B62M11/14, B60B19/00, B60B37/10, B60K7/00, B60K17/342",CS: Trakční kolová jednotka s řízeným natáčenímEN: Traction wheel unit with controlled rotation,"BEDNAR FMT s.r.o., Praha 9, Vinoř, Česká republika"
PUV,2022-39629,36242,Platný dokument,"B61L1/06, G01L1/24",CS: Kompozitní optovláknový senzor pro detekci tlakové síly vznikající průjezdem kola kolejového vozidla a jeho uspořádáníEN: Composite fibre optic sensor for detecting the pressure force generated by the passage of a rolling stock wheel and its arrangement,"PRODIN a.s., Pardubice, Zelené Předměstí, Česká republikaVysoká škola báňská - Technická univerzita Ostrava, Ostrava, Poruba, Česká republika"
PUV,2022-39692,35925,Platný dokument,"B60B33/00, B60B3/00, B60B15/00, B60B19/00, B60B35/16, B60K7/00, B60K17/00",CS: Trakční kolová jednotka s řízeným natáčenímEN: Traction wheel unit with controlled rotation,"BEDNAR FMT s.r.o., Praha 9, Vinoř, Česká republika"
PUV,2022-39701,36149,Platný dokument,"F24F1/02, F24F13/08, F24F13/24",CS: Interiérová klimatizační jednotkaEN: Indoor air conditioning unit,"Ing. Petr Morávek, CSc., Koberovy, Česká republika"
PUV,2022-39753,35983,Platný dokument,"C12Q1/68, C12Q1/686, C12Q1/6876, C12Q1/6888",CS: Analytická sada Ptig STRplex pro určení pohlaví a identifikaci jedinců Panthera tigrisEN: Ptig STRplex analytical kit for determining sex and identifying Panthera tigris individuals,"Forenzní DNA servis, s.r.o., Praha 7, Holešovice, Česká republika"
PUV,2022-39757,35984,Platný dokument,"C12Q1/68, C12Q1/686, C12Q1/6876, C12Q1/6888",CS: Analytická sada Ptig Qplex pro determinaci druhu Panthera tigris v neznámém vzorku a stanovení kvality a množství izolované jaderné DNAEN: Ptig Qplex analytical kit for determining the species Panthera tigris in an unknown sample and determining the quality and quantity of isolated nuclear DNA,"Forenzní DNA servis, s.r.o., Praha 7, Holešovice, Česká republika"
PUV,2022-39758,35985,Platný dokument,"C12Q1/68, C12Q1/686, C12Q1/6876, C12Q1/6888",CS: Analytická sada Ahya STRplex pro určení pohlaví a identifikaci jedinců Anodorhynchus hyacinthinusEN: Ahya STRplex analytical kit for determining sex and identifying Anodorhynchus hyacinthinus individuals,"Forenzní DNA servis, s.r.o., Praha 7, Holešovice, Česká republika"
PUV,2022-39759,35986,Platný dokument,"C12Q1/68, C12Q1/686, C12Q1/6876, C12Q1/6888",CS: Analytická sada Ahya Qplex pro determinaci druhu Anodorhynchus hyacinthinus v neznámém vzorku a stanovení kvality a množství izolované DNAEN: Ahya Qplex analytical kit for determining the species Anodorhynchus hyacinthinus in an unknown sample and determining the quality and quantity of isolated DNA,"Forenzní DNA servis, s.r.o., Praha 7, Holešovice, Česká republika"
PUV,2022-39760,35987,Platný dokument,"C12Q1/68, C12Q1/686, C12Q1/6876, C12Q1/6888",CS: Analytická sada Pate STRplex pro určení pohlaví a identifikaci jedinců Probosciger aterrimusEN: Pate STRplex analytical kit for determining sex and identifying Probosciger aterrimus individuals,"Forenzní DNA servis, s.r.o., Praha 7, Holešovice, Česká republika"
PUV,2022-39761,35988,Platný dokument,"C12Q1/68, C12Q1/686, C12Q1/6876, C12Q1/6888",CS: Analytická sada Pate Qplex pro determinaci druhu Probosciger aterrimus v neznámém vzorku a stanovení kvality a množství izolované DNAEN: Pate Qplex analytical kit for determining the species Probosciger aterrimus in an unknown sample and determining the quality and quantity of isolated DNA,"Forenzní DNA servis, s.r.o., Praha 7, Holešovice, Česká republika"
PUV,2022-39984,36223,Platný dokument,"C08L67/06, C08K9/00, C08K7/00, A01G9/029, C08L1/00",CS: Biologicky rozložitelná polymerní kompozice kompozitního charakteruEN: Composite biodegradable polymer composition,"Univerzita Tomáše Bati ve Zlíně, Zlín, Česká republika"
PUV,2022-40105,36491,Platný dokument,"C05F1/00, C05G1/00",CS: Kapalné listové hnojivo s biostimulačním účinkem na bázi bílkovinného hydrolyzátu směsných kolagenních odpadůEN: Liquid foliar fertilizer with a biostimulating effect based on the protein hydrolyzate of mixed collagen wastes,"Univerzita Tomáše Bati ve Zlíně, Zlín, Česká republika"
PUV,2022-40106,36492,Platný dokument,"C05F1/00, C05G1/00",CS: Kapalné listové hnojivo s biostimulačním účinkem na bázi nízkomolárního bílkovinného hydrolyzátu směsných kolagenních odpadůEN: Liquid foliar fertilizer with a biostimulating effect based on a low-molar protein hydrolyzate of mixed collagen wastes,"Univerzita Tomáše Bati ve Zlíně, Zlín, Česká republika"
PUV,2022-40143,36317,Platný dokument,"G16H50/30, A61B5/0205",CS: Monitorovací systém pro sledování zdravotního stavu pacientaEN: Monitoring system for monitoring the health of the patient,"České vysoké učení technické v Praze, Praha 6, Dejvice, Česká republika"
PUV,2022-40314,36641,Platný dokument,"A23L2/38, A61K36/481, A61K36/28, A61K36/53",CS: Imunito-adaptogenní nápojEN: Immuno-adaptogenic drink,"Výzkumný ústav rostlinné výroby, v. v. i., Praha 6, Ruzyně, Česká republika"
PUV,2022-40405,36569,Platný dokument,"A23L29/00, A23L33/21, A23L27/14",CS: Burger s přídavkem hmyzu a vlákninyEN: Burger with the addition of insects and fibre,"Výzkumný ústav potravinářský Praha, v. v. i., Praha 10, Hostivař, Česká republika"
PUV,2022-40416,36514,Platný dokument,"A01B51/02, A01B51/00, A01B69/00, A01B69/08",CS: Bočnicový modul agrorobotaEN: Agrorobot side module,"BEDNAR FMT s.r.o., Praha 9, Vinoř, Česká republika"
PUV,2022-40449,36767,Platný dokument,G01N33/44,"CS: Analyzátor urychleného stárnutí materiálu, zejména mechanicky a tepelně namáhané vulkanizované pryžeEN: Analyzer of accelerated material aging, especially mechanically and thermally stressed vulcanized rubber","Univerzita Tomáše Bati ve Zlíně, Zlín, Česká republika"
PUV,2022-40560,36818,Platný dokument,"A23J3/04, A23J3/16, A23J3/14, A23L27/14, A23L29/212, A23L33/21",CS: Imitace burgeru s přídavkem hmyzuEN: Imitation of a burger with the addition of insects,"Výzkumný ústav potravinářský Praha, v. v. i., Praha 10, Hostivař, Česká republika"
EP,2022-154825,4011806,Platný dokument,"B65G1/04, B65G1/06",EN: CONTAINER HANDLING VEHICLE WITH FIRST AND SECOND SECTIONS AND ASSEMBLY OF MOTORS IN SECOND SECTION FOR DRIVING AT LEAST ONE WHEEL OF EACH OF THE SETS OF WHEELS,"Autostore Technology AS, 5578 Nedre Vats Norge, Norsko"
EP,2022-164494,4062752,Neúčinný EP od počátku,"A01G17/02, A01G17/16, A01C11/04","EN: COMPANION PLANTING MODULE FOR VINE SEEDLINGS, COMPANION PLANTING DEVICE INCLUDING SAID MODULE","ELEVEN & CO, 16100 Merpins, Francie"
EP,2022-166225,4047983,Neúčinný EP od počátku,"H04W28/06, H04W74/00, H04W84/12","EN: WIRELESS COMMUNICATION METHOD USING TRIGGER INFORMATION, AND WIRELESS COMMUNICATOIN TERMINAL USING SAME","Wilus Institute of Standards and Technology Inc., Seongnam-si, Gyeonggi-do 13595, Korejská republikaSK TELECOM CO. LTD, Seoul 04539, Korejská republika"
EP,2022-177686,4163602,Platný dokument,"G01F1/00, E03B7/00, G01D4/00","EN: A DEVICE, METHOD AND SYSTEM FOR MONITORING A NETWORK OF FLUID-CARRYING CONDUITS","IP2IPO Innovations Limited, London EC4N 8AF, Velká Británie"
EP,2022-190161,4110000,Platný dokument,"H04W74/08, H04W84/12",EN: WIRELESS COMMUNICATION METHOD AND WIRELESS COMMUNICATION TERMINAL USING BASIC SERVICE SET IDENTIFICATION INFORMATION DETERMINATION OF RECEIVED FRAME,"Wilus Institute of Standards and Technology Inc., Seongnam-si, Gyeonggi-do 13595, Korejská republikaSK Telecom Co., Ltd., Seoul 04539, Korejská republika"
PV,2023-308,309991,Platný dokument,B01D29/07,CS: Těsný vzduchotechnický filtrEN: A tight air handling filter,"ATREA Group a.s., Jablonec nad Nisou, Rýnovice, Česká republika"
PUV,2023-40915,37068,Platný dokument,"H04L67/12, H04W4/70",CS: Koncové zařízení pro úzkopásmové 5G sítě s univerzálním rozhranímEN: A terminal device for narrowband 5G networks with a universal interface,"Univerzita Tomáše Bati ve Zlíně, Zlín, Česká republika"
PUV,2023-41057,37268,Platný dokument,"F24S25/16, F24S25/63, F24S25/65",CS: Nosná konstrukce pro fotovoltaické panely z geopolymeruEN: A support structure for photovoltaic panels made of geopolymer,"Bc. Aleš Bašta, Český Krumlov, Plešivec, Česká republikaBc. Vít Bašta, Český Krumlov, Plešivec, Česká republikaMiroslav Dvořák, Netolice, Česká republika"
PUV,2023-41208,37353,Platný dokument,B01D29/07,CS: Těsný vzduchotechnický filtrEN: A tight air conditioning filter,"ATREA Group a.s., Jablonec nad Nisou, Rýnovice, Česká republika"
PUV,2023-41439,37477,Platný dokument,"A01B35/30, A01B51/02, A01B69/04",CS: Modulární agrorobotEN: A modular agricultural robot,"BEDNAR FMT s.r.o., Praha 9, Vinoř, Česká republika"
EP,2023-150531,4194367,Platný dokument,"B65G1/04, B65G1/06",EN: SUPPORT VEHICLE FOR PERFORMING SUPPORT OPERATIONS IN AN AUTOMATED STORAGE AND RETRIEVAL SYSTEM,"Autostore Technology AS, 5578 Nedre Vats, Norsko"
PV,2018-661,308078,Zaniklý dokument,"H05B3/84, C03C17/36",CS: Topné bezpečnostní zaskleníEN: Safety heating glazing,"Prokop Vonasek, 3100 St. Pölten, Rakousko"
PV,2018-669,308353,Platný dokument,"G01N33/02, G01N33/14, G01N30/02","CS: Způsob určení přítomnosti chmele odrůdy Žatecký poloraný červeňák v neznámém vzorku hlávkového chmele, lisovaného chmele, chmelových pelet nebo pivaEN: Method for determining the presence of Žatec half-naked redhead hops in an unknown sample of head hops, pressed hops, hop pellets or beer","Výzkumný ústav pivovarský a sladařský, a.s., Praha 2, Nové Město, Česká republika"
PV,2018-701,308177,Platný dokument,"A61G7/075, A63B21/055, A63B22/08, A63B23/04",CS: Cvičební zařízení a lůžko s cvičebním zařízenímEN: Exercise equipment and bed with exercise equipment,"Fakultní nemocnice Hradec Králové, Hradec Králové, Nový Hradec Králové, Česká republika"
PUV,2018-34570,31878,Platný dokument,"C02F1/18, C02F1/52, C02F1/32, C02F9/02",CS: Dvoustupňová stavebnicová úpravna povrchové vody v kontejnerovém provedeníEN: A two-stage modular surface water treatment plant in a container version,"Ing. František Svoboda, CSc., Brno, Bohunice, Česká republika"
PUV,2018-34599,31594,Platný dokument,"C02F101/32, C02F1/40",CS: Zařízení k odstraňování olejovitých a ropných látek z vodyEN: A device for removing oil and petroleum substances from water,"Ing. František Svoboda, CSc., Brno, Bohunice, Česká republika"
PUV,2018-34785,31775,Zaniklý dokument,"A61K45/06, A61K31/74, A61K31/78, A61K31/787, A61K31/765, A61K47/50, A61K9/70, A61K9/107, A61K9/20, A61K9/02, A61K9/06, A61P17/02",CS: Přípravek na bázi interpenetrujících polymerních sítí pro hojení ranEN: A preparation based on interpenetrating polymer networks for wound healing,"Ústav makromolekulářní chemie AV ČR, v. v. i., Praha 6, Břevnov, Česká republika"
PUV,2018-34846,31948,Zaniklý dokument,"A01G25/06, A01B76/00",CS: Zařízení pro manipulaci se závlahovou hadicíEN: A device for handling the irrigation hose,"Výzkumný ústav zemědělské techniky, v. v. i., Praha 6, Ruzyně, Česká republika"
PUV,2018-34901,32089,Platný dokument,"A47C17/86, A47C17/00, A47C3/00",CS: Područka/opěrka pro sedací a lehací nábytekEN: An armrest/rest for seating and lying furniture,"České vysoké učení technické v Praze, Praha 6, Dejvice, Česká republika"
PUV,2018-34911,32177,Zaniklý dokument,G08B13/08,CS: Systém pro sledování pohybu objektůEN: An object tracking system,"Senzoor Czech s.r.o., Brno, Trnitá, Česká republika"
PUV,2018-35015,32035,Platný dokument,"A61F7/02, A61F13/00",CS: Multifunkční krycí prostředekEN: A multifunctional cover,"Bc. Martina Štefanková, Klášterec nad Ohří, Česká republika"
PUV,2018-35049,31972,Platný dokument,C12C12/00,"CS: Pivo připravené ze sladu, který je z 30 až 65 % tvořený ovesným slademEN: Beer made from malt, consisting of 30 to 65% of oat malt","Výzkumný ústav pivovarský a sladařský, a.s., Praha 2, Nové Město, Česká republika"
PUV,2018-35080,32486,Platný dokument,"G01R22/00, G01R22/10, G01R22/08",CS: Jednotné odběrné místo elektrické energieEN: Single electricity supply point,"RNDr. František Krejčí, CSc., Brno, Veveří, Česká republika"
PUV,2018-35086,32221,Platný dokument,"F25B29/00, B65D90/00",CS: Multifunkční mobilní kontejnerový monoblok komplexního systému tepelných čerpadel s vazbou na transportní platformuEN: A multifunctional mobile container monoblock of a complex heat pump system linked to a transport platform,"SLEZSKÁ MECHATRONIKA a.s., Ostrava, Moravská Ostrava, Česká republika"
PUV,2018-35185,32226,Zaniklý dokument,"A61K33/06, A61K31/78, A61K31/787, A61K31/74, A61F13/02, A61K9/10",CS: Tekutý krycí přípravek pro ošetření ranEN: A liquid dressing preparation for the treatment of wounds,"Ústav makromolekulární chemie AV ČR, v. v. i., Praha 6, Břevnov, Česká republika"
PUV,2018-35222,32234,Platný dokument,"E01F15/04, E04H17/20",CS: Sloupek s výztuhou pro záchytné dopravní systémy a záchytný dopravní systémEN: A post with reinforcement for retaining transport systems and a retaining transport system,"STAVBY OMO s.r.o., Hranice, Hranice I-Město, Česká republika"
PUV,2018-35223,32025,Platný dokument,"B01D17/02, B01D17/04",CS: Zařízení pro odlučování ropných a olejových látek z vodyEN: A device for separating petrol and oil substances from water,"Ing. František Svoboda, Brno, Bohunice, Česká republika"
PUV,2018-35224,32359,Platný dokument,"A01N33/12, A01N65/00, A61K31/01, C07D487/04",CS: Kvarterní amoniová sůl a dezinfekční kompozice jí obsahujícíEN: A quaternary ammonium salt and a disinfectant composition comprising it,"Fakultní nemocnice Hradec Králové, Hradec Králové, Nový Hradec Králové, Česká republika"
PUV,2018-35282,32841,Výmaz dokumentu,"A01N59/26, A01N25/30, A01N25/02, A01P21/00",CS: Přípravek ochrany listnatých stromů proti jmelí bílémuEN: Product to protect deciduous trees from mistletoe,"SAFE TREES, s.r.o., Brno, Sadová, Česká republika"
PUV,2018-35412,32496,Platný dokument,"F26B17/10, F26B21/02",CS: Rozprašovací sušárnaEN: Spray dryer,"České vysoké učení technické v Praze, Praha 6, Dejvice, Česká republika"
PUV,2018-35441,32376,Platný dokument,G01N23/223,CS: Rentgenfluorescenční skenovací analyzátorEN: An X-ray fluorescence scanning analyzer,"České vysoké učení technické v Praze, Praha 6, Dejvice, Česká republika"
PUV,2018-35734,32533,Platný dokument,"G09F15/00, G09F9/35, G08G1/123",CS: Zastávkový označníkEN: Stop marker,"Ing. Stanislav Koucký, Liberec, Liberec XV-Starý Harcov, Česká republika"
EP,2018-152687,3514545,Platný dokument,"G01N33/574, G01N33/92",CS: Způsob diagnostiky rakoviny slinivky založený na lipidomické analýze tělní tekutinyEN: A METHOD OF DIAGNOSING PANCREATIC CANCER BASED ON LIPIDOMIC ANALYSIS OF A BODY FLUID,"FONS JK Group, a.s., Pardubice, Pardubice-Staré Město, Česká republika"
EP,2018-153026,3471375,Neúčinný EP od počátku,H04L29/08,EN: METHOD AND APPARATUS FOR MANAGING FIELD DEVICE BASED ON CLOUD SERVER,"Kyland Technology Co., Ltd., Beijing 100041, ČínaCoreTek Systems Incorporated, Beijing, Čína"
EP,2018-174963,3575793,Platný dokument,"G01N33/574, G01N33/92",CS: Způsob diagnostiky rakoviny na základě lipidomické analýzy tělní tekutinyEN: A METHOD OF DIAGNOSING CANCER BASED ON LIPIDOMIC ANALYSIS OF A BODY FLUID,"FONS JK Group, a.s., 53002 Pardubice, Česká republika"
EP,2018-191316,3461812,Neúčinný EP od počátku,"C07D211/46, A61K31/445, A61P3/00, A61P25/16, A61P9/10",EN: N-(5-(BIPHEN-4-YLMETHYLOXY)PENTYL)-SUBSTITUTED IMINOSUGARS AS INHIBITORS OF GLUCOSYLCERAMIDE SYNTHASE,"Academisch Medisch Centrum, 1105 AZ  Amsterdam Zuidoost, NizozemskoUniversiteit Leiden, 2311 EZ Leiden, Nizozemsko"
EP,2018-195904,3459878,Neúčinný EP od počátku,"B65F1/06, G06Q10/06, G06Q10/08, G06Q50/26",EN: SYSTEM AND METHOD FOR TRACKING FILLING OF A SET OF WASTE CONTAINERS,"Nicollin Holding, 69100 Saint Fons, FrancieAppulz, 73800 Coise-Saint-Jean-Pied-Gauthier, Francie"
EP,2018-196971,3461976,Neúčinný EP od počátku,"E05C9/00, E05B47/06, E05B17/20",EN: IMPROVED DOOR LOCKING MECHANISM,"Dedlok Ltd, Bradford, West Yorkshire BD13 1PX, Velká Británie"
EP,2018-199968,3470884,Neúčinný EP od počátku,"G01V1/18, G01V13/00",EN: METHOD FOR FILTERING A RESPONSE SIGNAL FROM A GEOPHONE AND ASSOCIATED SENSOR,"Staneo, 31100 Toulouse, Francie"
EP,2018-200218,3453382,Neúčinný EP od počátku,"A61K8/98, A61K35/28, A61K35/44, A61K35/12, A61Q19/00, A61K8/02, A61K35/51, A61K8/04, A61K9/06, A61P17/00, A61P17/02, A61P17/18",EN: COMPOSITION INCLUDING STEM CELL-DERIVED EXOSOME FOR SKIN WHITENING OR WRINKLE IMPROVEMENT,"Exostemtech Co., Ltd., Sangrok-gu
Ansan-si, Gyeonggi-do
15588, Korejská republika"
EP,2018-702551,3592893,Platný dokument,"D06B1/02, B41M5/00, B41J3/407, B41J11/00, B41J29/17",EN: APPARATUS AND METHOD FOR SPRAY TREATING FABRIC,"Durst Group AG, 39042 Brixen, Itálie"
EP,2018-712001,3583406,Neúčinný EP od počátku,"G01N21/45, G01N21/77, G01N21/552",EN: INTEGRATED PLASMO-PHOTONIC BIOSENSOR AND METHOD OF USE,"ARISTOTLE UNIVERSITY OF THESSALONIKI - E.L.K.E., 
Research Committee, 54 636 Thessaloniki, ŘeckoGesellschaft für Angewandte Mikro- und 
Optoelektronik mit Beschränkter Haftung - AMO GmbH, 52074 Aachen, Spolková republika Německo"
EP,2018-712899,3601253,Neúčinný EP od počátku,"C07D401/12, C07D239/30, C07D498/04, A61K31/519, A61P9/00, A61P35/00",EN: NOVEL PTEFB INHIBITING MACROCYCLIC COMPOUNDS,"Bayer Aktiengesellschaft, 51373 Leverkusen, Spolková republika NěmeckoBayer Pharma Aktiengesellschaft, 13353 Berlin, Spolková republika Německo"
EP,2018-721975,3615518,Platný dokument,C07D295/06,CS: Způsob výroby HBr alpha-formy vortioxetinuEN: PROCESS FOR THE MANUFACTURE OF VORTIOXETINE HBR ALPHA-FORM,"H. Lundbeck A/S, 2500 Valby, Dánsko"
EP,2018-722497,3619237,Platný dokument,"C07K16/30, A61P35/00",CS: Protilátky proti karcinoembryonálnímu antigenu pro léčení a diagnostiku rakovinyEN: ANTIBODIES AGAINST CARCINOEMBRYONIC ANTIGEN FOR CANCER THERAPY AND DIAGNOSIS,"B Cell Design, 87069 Limoges, Francie"
EP,2018-739222,3568216,Neúčinný EP od počátku,A63B21/00,EN: EXERCISE WEIGHT SELECTION DEVICE AND METHOD,"Meredith, Jeffrey Owen, Del Mar, CA 92014, Spojené státy americké"
EP,2018-742547,3649090,Neúčinný EP od počátku,"C03B37/012, C03B23/207, G02B6/28, G02B6/02",EN: METHOD FOR FABRICATING AN OPTICAL FIBRE PREFORM,"University Of Southampton, Southampton, Hampshire S017 1BJ, Velká Británie"
